{
  "schemaVersion": "0.1",
  "provider": "react-aria",
  "packages": [
    { "name": "react-aria", "version": "0.0.0-fixture", "integrity": "sha512-fixtureReactAria" },
    { "name": "react-aria-components", "version": "0.0.0-fixture", "integrity": "sha512-fixtureComponents" },
    { "name": "react-stately", "version": "0.0.0-fixture", "integrity": "sha512-fixtureStately" }
  ],
  "evidence": [
    {
      "id": "react-aria.button.fixture",
      "url": "https://react-aria.adobe.com/Button",
      "digest": "sha256:4639fb2ca0eef99003c8d4d0cfcf2715b9563f677df65152261dd772fff249d5",
      "retrievalPolicy": "pinned-artifact",
      "artifactPath": "fixtures/behavior-evidence/button.fixture.html"
    },
    {
      "id": "react-aria.dialog.fixture",
      "url": "https://react-aria.adobe.com/Dialog",
      "digest": "sha256:7a5980d22d4eca41f094ac53465787d4e3ce3c1b4d20d12eda217f747f9723f2",
      "retrievalPolicy": "pinned-artifact",
      "artifactPath": "fixtures/behavior-evidence/dialog.fixture.html"
    },
    {
      "id": "react-aria.select.fixture",
      "url": "https://react-aria.adobe.com/Select",
      "digest": "sha256:b04b595b6ba54aba51352553a0659b15375d964cf5919470624c6bc5a94d5251",
      "retrievalPolicy": "pinned-artifact",
      "artifactPath": "fixtures/behavior-evidence/select.fixture.html"
    }
  ],
  "manifestDigest": "sha256:f0735cfd23b13c35a497ad8b35c5f91a466e3021bfcb14762c3e43c028ba8ddf"
}
